user_id,screen_name,created_at,status_id,favorite_count,retweet_count,text
x33537967,amyklobuchar,2018-11-15T23:08:03Z,x1063207027999195141,4540,745,Breaking news: Florida senate race heads to a manual recount!  #CountEveryVote
x33537967,amyklobuchar,2018-11-16T00:50:52Z,x1063232904103424000,4090,1507,We sent an important letter to DOJ today on Facebook following reports that they had hired an outside contractor to research and spread info on critics. https://t.co/x9myGG46w9
x33537967,amyklobuchar,2018-11-16T17:44:35Z,x1063488013089611777,1531,232,"Will be there today when Alan Page receives the Medalof Freedom.  Saw him &amp; his family last night &amp; they couldn’t be prouder. He broke barriers: in the NFL, in law school, and on the MN Supreme Court: Alan Page:It is an honor, but it's not really about me. https://t.co/gKVFlGaqyb"
x33537967,amyklobuchar,2018-11-16T21:08:15Z,x1063539265555111936,740,64,A wonderful Medal of Honor award at the White House for my friend Alan Page (here with his son Justin) and Justice Kagan too! https://t.co/ET8EcPTqpO
x33537967,amyklobuchar,2018-11-17T03:08:48Z,x1063630001403305984,706,132,Thanks Nicki! “Nevertheless We Persisted” is an amazing collection of short essays by people who have overcome great obstacles and emerged stronger. It was an honor to be asked to do the Foreword. Lesson? The obstacles on the path aren’t always obstacles; they are the path. https://t.co/8AExQMMHLJ
x33537967,amyklobuchar,2018-11-17T05:37:19Z,x1063667379580952576,8259,1881,"To @StaceyAbrams &amp; everyone pushing to make all voices heard in our democracy, thank you. You and your Georgia team are extraordinary.  More to come I know!  Many chapters ahead for you....
RT: https://t.co/2nWsxhYEgV"
x33537967,amyklobuchar,2018-11-17T12:43:16Z,x1063774571822747648,1554,443,"“Mr. Cotton (perhaps loudest critic of sentencing changes) urged colleagues to slow down, saying that the bill’s implications were too expansive to push through without hearings” REALLY? We’ve had multiple hearings.  Time for action. Pass #FirstStepAct   https://t.co/kzZ9nyBfRR"
x33537967,amyklobuchar,2018-11-17T14:21:02Z,x1063799174125236224,7668,1633,Our courts shouldn’t have to do this. The credentials shouldn’t have been taken away in the first place. The freedom of the press is critical to our democracy. https://t.co/eoQMxqd061
x33537967,amyklobuchar,2018-11-17T16:12:43Z,x1063827280005398531,2534,448,"We’ve secured over $46 million in additional funding for MinnesotaCare, MN’s basic healthcare program I’ve long advocated for. This is an important step forward for affordable, comprehensive coverage for many Minnesotans."
x33537967,amyklobuchar,2018-11-17T17:21:51Z,x1063844680096538624,412,97,"One day each year, @GiveMN encourages Minnesotans to donate to their favorite charity in a statewide effort to raise as much money as possible for nonprofits. On Thursday, Minnesotans set a record of $21.06 million! Way to go! https://t.co/IV2yLzkktl"
x33537967,amyklobuchar,2018-11-17T18:44:27Z,x1063865467964743680,4178,1401,"As author of Honest Ads Act, need answers re @nytimes reports that Facebook hired partisan firm to spread negative info about its critics (including electeds) to press &amp; online. This is modern-day internet equivalent of hiring thugs to take down your enemies. Pass Honest Ads Act!"
