user_id,screen_name,created_at,status_id,favorite_count,retweet_count,text
x23970102,BillOReilly,2018-10-25T00:51:11Z,x1055260447790764033,6215,1414,The leftist media going full throttle blaming President Trump for the bomb business. It’s pretty nasty. I’ve just posted a message about it on https://t.co/rryWmyXe7C. Hope you check it out.
x23970102,BillOReilly,2018-10-25T12:09:21Z,x1055431116050649088,5376,1210,Amazing hypocrisy on display by the leftist media covering the bomb story. I call it out in the Message of the Day on https://t.co/lJObnAakkl.
x23970102,BillOReilly,2018-10-25T15:43:43Z,x1055485061783580673,4490,1798,"Every person in the migrant caravan needs food, water &amp; facilities. There are vehicles involved &amp; tents &amp; other things that cost money. There are organizers on the scene--https://t.co/9XVZzcgdom"
x23970102,BillOReilly,2018-10-25T15:48:15Z,x1055486203653447680,3046,1164,"In August, the activist group Pueblo Sin Fronteras put the word out on social media that asylum could be obtained in America if certain directions were followed. Thus, the planned mass journey began to take shape."
x23970102,BillOReilly,2018-10-25T19:37:03Z,x1055543784648388614,3203,775,CBS glorifies George Soros who was a bomb target.  I have to correct the record on Soros and will do so on the @NoSpinNews tonight on https://t.co/rryWmyXe7C.
x23970102,BillOReilly,2018-10-25T21:00:00Z,x1055564657816154113,867,156,"Earlier this year, the migrant child separation deal on the border worked well for the left as President Trump had to change his immigration policy because “babies were being ripped from their mothers.”"
x23970102,BillOReilly,2018-10-25T21:15:00Z,x1055568432752680962,2565,820,"The plan seems to be to goad President Trump into doing something that will mobilize young liberals and Hispanics to vote for Democrats in the midterms. 

https://t.co/9XVZzcgdom"
x23970102,BillOReilly,2018-10-26T11:00:01Z,x1055776055481425922,15712,4463,Don’t count on the corrupt American media to uncover the money behind the caravan just as the press ignored the presence of far left zealots in the Kavanaugh controversy.
x23970102,BillOReilly,2018-10-26T11:05:00Z,x1055777308466798592,5041,1524,"Again, a journalist’s mission is to try to find the truth of a story.  Do you think that’s happening in the age of Trump?

Do you?

https://t.co/9XVZzcxOfU"
x23970102,BillOReilly,2018-10-26T13:29:29Z,x1055813669685248002,2970,1188,CBS News not telling the truth about George Soros.  Please check out the Message of the Day on https://t.co/rryWmyXe7C--https://t.co/ViXxhI94pp
x23970102,BillOReilly,2018-10-26T15:00:01Z,x1055836453270241281,625,46,Somebody has to do it! https://t.co/44GxeJFz9v
x23970102,BillOReilly,2018-10-26T19:22:23Z,x1055902479777492993,5796,1061,"As we predicted, authorities have quickly arrested the bomb guy who looks like a complete loon from what we know about him. He’s innocent until proven guilty but he will be proven guilty and will serve decades in prison."
x23970102,BillOReilly,2018-10-26T19:22:55Z,x1055902611830915073,11066,1954,The media will politicize this but not me. A crime was committed and now it looks like it has been solved. Period.
x23970102,BillOReilly,2018-10-27T13:00:01Z,x1056168641119612929,5833,1768,"If the migrant caravan was secretly designed as a political play to hurt President Trump and the republicans in the November vote, that is one enormous story-https://t.co/9XVZzcgdom"
x23970102,BillOReilly,2018-10-27T14:40:49Z,x1056194008559562753,970,168,"“Killing the SS: The Hunt for the Worst War Criminals in History” is the number one non-fiction book in America this weekend.  You can read an excerpt and listen to part of the audio book on https://t.co/rryWmyXe7C.  It’s chilling.

https://t.co/C8xBIv1tnu"
x23970102,BillOReilly,2018-10-29T13:14:07Z,x1056896967148822528,1853,446,"Some horrendous people are trying to use the Synagogue murders to brand political opponents anti-semitic.  Despicable. Please read the Message of the Day on https://t.co/rryWmyXe7C.

https://t.co/TJmIqbptSm"
x23970102,BillOReilly,2018-10-29T15:40:55Z,x1056933910452543489,16178,4630,It is literally horrifying for me to hear charges of mass anti-Semitism made for political reasons.  I worked on my new book Killing the SS for a year so I understand what true anti-Semitism is. To diminish this evil by applying it dishonestly for political gain is barbaric.
x23970102,BillOReilly,2018-10-29T16:30:00Z,x1056946262719647747,1568,310,"Politics in America have never been more poisonous.  Tonight on the @NoSpinNews we’ll continue our honest analysis of the recent terrorism, the migrant caravan, and the upcoming election.  

Important show this evening."
x23970102,BillOReilly,2018-10-30T13:15:48Z,x1057259778190311426,927,268,"President Trump continues to say that some members of the press are enemies of the people.  But it’s far more than that.  Please check out the Message of the Day on https://t.co/rryWmyXe7C.

https://t.co/8yoIuKbA96"
x23970102,BillOReilly,2018-10-30T13:18:14Z,x1057260388377616384,2471,729,"During the Vietnam War, the Viet Cong communists were expert at disrupting the South Vietnamese infrastructure.  That eroded the people’s confidence in the Saigon regime and drastically weakened it.

The same thing is happening today in America."
x23970102,BillOReilly,2018-10-30T13:30:00Z,x1057263351284170752,3199,804,Read almost any newspaper or watch network or most cable news &amp; you will absorb negative stories about the Trump administration ad Infinitum. The latest being the President is partially responsible for the terror bombs and the Synagogue massacre because of his persona &amp; rhetoric.
x23970102,BillOReilly,2018-10-30T13:45:00Z,x1057267124886888448,16163,4350,"The cold truth is that the vast majority of the American press is fighting a guerrilla war against the President, hoping to wear him out &amp; turn public opinion against him. In turn, Trump counter attacks &amp; creates ill will toward the press by disparaging his constant critics."
x23970102,BillOReilly,2018-10-30T14:00:00Z,x1057270901950111745,21968,8500,"The fix was in the moment President Trump defeated Hillary Clinton.  The media chieftains and their corporate masters immediately launched a guerrilla campaign to bring down the Trump administration.  
 
And that’s what we are seeing play out."
x23970102,BillOReilly,2018-10-31T13:14:36Z,x1057621863894016000,848,147,Today is the Eve of all Hallows and many spooky things are happening in America. Here’s a partial list--https://t.co/5OPWHEIgsJ
x23970102,BillOReilly,2018-10-31T16:45:00Z,x1057674812418473985,507,92,"There are a number of scary things negatively affecting all Americans this Halloween.  They are listed in the Message of the Day posted now on https://t.co/rryWmzeOZa.

https://t.co/gaZjMaFk5W"
x23970102,BillOReilly,2018-10-31T19:30:00Z,x1057716337743708162,7515,2406,"It is terrifying that so many Americans have no idea that powerful political groups are putting out vicious propaganda unchallenged.
 
 It’s an industry now-https://t.co/5OPWHEIgsJ"
x23970102,BillOReilly,2018-11-01T12:39:06Z,x1057975318835716097,777,83,"Yes, you can pet me.  But only after reading the Message of the Day--https://t.co/TFXy3frsiY &amp; the Column on extremism-- https://t.co/Jg66rcZlGr posted on https://t.co/rryWmzeOZa. https://t.co/rkZuofjqrr"
x23970102,BillOReilly,2018-11-01T17:39:27Z,x1058050901217345538,1115,291,"The press endorsed all the “misconduct” allegations thrown at the Justice w/ headlines and TV sound bites. So why has the allegation story gone dormant? As Hemingway points out, any journalist finding corroboration of charges against Kavanaugh would instantly become a media hero. https://t.co/4DYJM2M03W"
x23970102,BillOReilly,2018-11-01T17:41:04Z,x1058051307918028800,3302,941,The national press no longer seeks the truth. It is content to enthusiastically accuse people especially non-liberal high-profile folks. They almost got Kavanaugh. That was apparently enough. Why investigate further when the facts might show his innocence? https://t.co/UnBS3sqHa6
x23970102,BillOReilly,2018-11-02T12:51:58Z,x1058340943148007424,3041,999,A new poll shows that the media has sold it’s soul to the devil!  How? Please read the Message of the Day on https://t.co/rryWmyXe7C-- https://t.co/hIHwKwcSwR
x23970102,BillOReilly,2018-11-02T16:42:16Z,x1058398900221104128,6961,1437,At this point much of cable news is boring and predictable.  There’s little perspective in reporting about the President and hate on display is tedious.  I have tuned out.
x23970102,BillOReilly,2018-11-02T17:00:02Z,x1058403372695355392,39777,10160,"When Mr. Trump leaves the stage, watch what happens to network and cable news.  He’s the entire industry now.  Without him, there’s nothing."
x23970102,BillOReilly,2018-11-02T18:30:00Z,x1058426010922737664,12299,4892,"Americans, even those who despise Mr. Trump, understand the media has sold itself to the devil, have largely stopped informing the folks.  The national press has become a weapon of mass destruction.
 
And Americans know it--https://t.co/hZst1pGaRo"
x23970102,BillOReilly,2018-11-04T20:57:41Z,x1059187951450644480,904,86,All these political ads make me itchy. Best election coverage on https://t.co/rryWmyXe7C https://t.co/HhovxxgTnH
x23970102,BillOReilly,2018-11-05T13:42:01Z,x1059440702667526145,669,147,"Will the migrant caravan situation be enough for a Republican win tomorrow? Please read the Message of the Day on https://t.co/rryWmyXe7C.

https://t.co/xvscHCZk8E"
x23970102,BillOReilly,2018-11-05T13:49:10Z,x1059442501290000384,861,332,.@VDHanson pens a devastating column on CNN. Check it out on the website American Greatness--https://t.co/OBFVHmOJCf
x23970102,BillOReilly,2018-11-05T14:15:00Z,x1059449002096295936,2198,473,"There is no question that the caravan has become yet another flash point in the social civil war that is raging in America, and the migrant march to the US border has become a major campaign issue as well."
x23970102,BillOReilly,2018-11-05T14:30:00Z,x1059452776793755648,4396,1194,Immigration laws must be enforced or the nation drifts into anarchy and Americans get hurt.
x23970102,BillOReilly,2018-11-05T15:00:00Z,x1059460328424202240,48685,18902,It is almost beyond comprehension that the Democratic Party basically supports open borders and is fine with providing welfare payments to millions of undocumented aliens when the country is $22 trillion in debt.
x23970102,BillOReilly,2018-11-05T16:15:12Z,x1059479253379616769,524,102,"Want NO SPIN analysis of the midterm results? I will be live tomorrow at 10p eastern on https://t.co/rryWmyXe7C’s @NoSpinNews. Usually for Members but this is important stuff so we are doing a free 30 day trial, sign up to watch – https://t.co/QFPIdAqoDd"
x23970102,BillOReilly,2018-11-05T20:00:00Z,x1059535825380069377,4313,1515,"How destructive to the country is the open border philosophy?  

Catastrophically destructive.

Yet the left mocks those who want border security and protective laws--https://t.co/xvscHDgV0c"
x23970102,BillOReilly,2018-11-06T14:06:52Z,x1059809345268080641,16654,4807,"The best thing to do today is refrain from watching the propaganda fest on the news networks. At seven eastern time you can begin sampling, but meaningful results will not be available until after nine."
x23970102,BillOReilly,2018-11-06T14:12:19Z,x1059810714418905088,2715,828,Be very skeptical of news coverage before the polls close today.  Many news agencies will not report accurately. Please check out the Message of the Day for honest analysis- https://t.co/i0vDi640UJ
x23970102,BillOReilly,2018-11-06T17:11:39Z,x1059855847357059074,1625,337,Election update: one cable news pundit just said “both parties are hoping for a good outcome.” Who knew? Get smart vote coverage on https://t.co/rryWmyXe7C. https://t.co/I9m6YQggHF
x23970102,BillOReilly,2018-11-06T19:54:41Z,x1059896873459294208,1103,98,Corgis should have the vote! https://t.co/KNoBWwbCur
x23970102,BillOReilly,2018-11-06T22:32:23Z,x1059936562664873985,5976,1660,"Lack of data is not stopping the cable news channels from issuing bogus analysis. Enough is enough - change the channel on fake news. My live coverage begins at 10p eastern. No spin, no bull - just facts. https://t.co/dTECJA50kG"
x23970102,BillOReilly,2018-11-06T23:57:42Z,x1059958031914545152,3963,941,Don’t waste your time with the dishonest networks. I’ll cut through the bull tonight. No spin. Just facts. https://t.co/dHruRat8qu
x23970102,BillOReilly,2018-11-07T00:23:18Z,x1059964472624930817,214,40,Check my website. https://t.co/ezjoTupF3b for a free trial to watch tonight. https://t.co/gSk1losqrB
x23970102,BillOReilly,2018-11-07T00:26:05Z,x1059965174814269440,1225,195,"Thanks for the kind words, Laura. The @NoSpinNews podcast on my website is the proper venue in that I run the show and can say whatever I want - no commercial breaks, no frightened executives. https://t.co/5zOUG6ukyF"
x23970102,BillOReilly,2018-11-07T00:42:17Z,x1059969252915113984,488,72,Maybe I'll let @GlennBeck talk tonight. To be determined. https://t.co/opZkMCtrvi
x23970102,BillOReilly,2018-11-07T01:13:19Z,x1059977061664808960,404,74,"YES! Live tonight on Roku, Apple TV, Amazon Fire TV, &amp; many other MACHINES. 

Search ""Bill O'Reilly"" in the app store ... do I sound like I know what I'm talking about?? https://t.co/NM9ri5KChH"
x23970102,BillOReilly,2018-11-07T01:55:31Z,x1059987682535899137,1716,190,Really made me rethink my entire perspective on the Texas race. https://t.co/TQTGvXDicT
x23970102,BillOReilly,2018-11-07T01:58:22Z,x1059988398570696704,3300,617,Republicans are upsetting @CNN at this point. See you in a little while - will be live on https://t.co/rryWmyXe7C at 10 pm eastern.
x23970102,BillOReilly,2018-11-07T02:32:36Z,x1059997015411691521,641,107,On @CRTV with my old pal @EricBolling right now. Check it out. https://t.co/OWeMfMtPCu
x23970102,BillOReilly,2018-11-07T13:35:44Z,x1060163898068885504,10465,2205,"Americans protected President Trump by widening the Republican margin in the Senate, but rewarded the “resistance” by giving the House to the Democrats.

Both sides are claiming victory, of course, but the truth is that political hatred in America is alive and growing."
x23970102,BillOReilly,2018-11-07T21:37:57Z,x1060285252285984774,2173,438,CNN’s White House correspondent disrupts a Presidential press coverage.  He was way out of line. Honest analysis on https://t.co/rryWmyXe7C and the @NoSpinNews beginning at 7 eastern time. https://t.co/wfzzS6nuAa
x23970102,BillOReilly,2018-11-08T00:56:49Z,x1060335297651716096,13978,2969,"Hate to say this, but the Trump administration would be in the right if it pulled Acosta’s credentials. https://t.co/hqAkbXefdG"
x23970102,BillOReilly,2018-11-08T01:04:26Z,x1060337215660847105,8594,2012,"That was fast. As a member of the WH Press Corps, it is Jim Acosta’s job to get information to CNN viewers, not be captain of the debate team. 

If he wants to give opinions, CNN should give him a primetime show. https://t.co/eXPaCet2sM"
x23970102,BillOReilly,2018-11-08T03:10:18Z,x1060368889052364800,33405,9891,"Pinhead Jim Acosta was taking valuable time way from the American people who want information, not a debate. 

No one cares what he thinks, least of all President Trump. https://t.co/AulpPbHEMT"
x23970102,BillOReilly,2018-11-08T14:57:30Z,x1060546862682382336,3387,704,Please read my just posted weekly column on CNN’s White House correspondent Jim Acosta. https://t.co/F4saYLFrhT
x23970102,BillOReilly,2018-11-08T17:10:28Z,x1060580324994961408,14914,4119,"As someone who has interviewed five presidents, I know it is a difficult task. Skilled journalists know that you can be persistent without being disrespectful. You must think about your tone and phrasing. 

Mr. Acosta does not do that. https://t.co/hqAkbXefdG"
x23970102,BillOReilly,2018-11-09T00:51:30Z,x1060696348478136320,15471,5380,I had to have armed security guards live INSIDE my house. Those who incite violence should be charged. That's the only way the madness will stop. Talked about it with @SeanHannity today- https://t.co/RTaEVjdceG
x23970102,BillOReilly,2018-11-09T14:59:31Z,x1060909758075600896,8861,2134,"Major news week but behind the scenes, the brakes are being applied to radical left advances as Mr. Trump is appointing scores of non-liberal federal judges.

That will continue for at least two more years as Republicans control the Senate which confirms federal judges."
x23970102,BillOReilly,2018-11-10T15:42:01Z,x1061282842251091968,1274,192,"Astute post-election coverage now posted on https://t.co/rryWmyXe7C starring me, @SeanHannity, @GlennBeck, many more. Also, ‘Killing the SS’ again topping the bestseller list this weekend. Hope you check it out."
x23970102,BillOReilly,2018-11-12T14:59:02Z,x1061996799257391104,19976,5297,Almost impossible for me to listen to the propaganda much less read newspapers which routinely distort almost everything in pursuit of maligning the President. I look at Drudge but trying to get valid information from the articles is like waterskiing in the Sahara: not likely.
x23970102,BillOReilly,2018-11-12T22:57:02Z,x1062117089639579648,738,97,Bernie Goldberg @BernardGoldberg and I discuss CNN vs. President Trump on tonight’s @NoSpinNews.  Please check out https://t.co/rryWmyXe7C beginning at 7 eastern time.
x23970102,BillOReilly,2018-11-13T14:58:12Z,x1062358979030978561,929,222,"What’s the true story about election recounts? Check out https://t.co/rryWmyXe7C for honest coverage. 

Also, more blatant media bias. Please read the Message of the Day - https://t.co/JWOxIaetvO"
x23970102,BillOReilly,2018-11-13T17:20:32Z,x1062394795967029250,8202,2419,It’s hard to believe but there are some Americans who still do not believe the media promotes leftwing causes. Like Michelle Obama’s book. Like Bob Woodward’s anti-Trump book. Check out the offerings from Oprah’s book club and tell me if any traditional reads make the cut. https://t.co/uCXL7QALKR
x23970102,BillOReilly,2018-11-13T18:56:38Z,x1062418979677986823,1028,123,Is the election over yet? https://t.co/eOvL4ps7Wm
x23970102,BillOReilly,2018-11-13T19:15:07Z,x1062423630854975488,1249,222,"The former First Lady’s book will knock KSS off the top spot on NYT bestseller list- that’s fine. I do not begrudge Mrs. Obama’s success. In my limited dealings with her she was always very nice. In fact, at a WH Christmas party she went out of her way to speak with my daughter. https://t.co/Ui84Q0nCWs"
x23970102,BillOReilly,2018-11-14T14:56:13Z,x1062720866436464641,2032,377,"Are Americans turning away from the news? Very possible. Please read my Message of the Day. Also, Dennis Miller tonight on the @NoSpinNews! Check it out. https://t.co/wwZivuWWQR"
x23970102,BillOReilly,2018-11-14T19:05:20Z,x1062783558673145861,2976,332,I would not misbehave at a White House briefing. https://t.co/l13YWz4zUh
x23970102,BillOReilly,2018-11-15T13:55:08Z,x1063067879866818561,2671,563,"The Trump administration has officially declared war on the media. It remains to be seen if the judiciary understands that it is not journalism involved in the White House controversy, but show business- https://t.co/FSc0YDQzZW 
https://t.co/FSc0YDQzZW"
x23970102,BillOReilly,2018-11-15T14:30:07Z,x1063076686252642305,3321,641,"I’m not a big ""kick-folks-when-they’re-down"" kind of guy but the arrest of Michael Avenatti on domestic assault charges is downright eerie. Seems he's on the ropes- you can decide if he deserves it.

https://t.co/lqf3PuvcQP"
x23970102,BillOReilly,2018-11-15T14:45:00Z,x1063080430461698055,723,129,"Tonight on the @NoSpinNews,  I will analyze how evil is being processed in America.  I think you’ll find the broadcast compelling."
x23970102,BillOReilly,2018-11-15T19:32:02Z,x1063152666644221953,1089,377,"CNN and MSNBC protect Avenatti.  Please read Message of the Day on https://t.co/rryWmyXe7C.

https://t.co/fzJUZlZwvN"
x23970102,BillOReilly,2018-11-15T22:00:00Z,x1063189904455168000,8083,3104,"CNN &amp; most of the national media is no longer in business to bring information to Americans, their game plan now is to destroy the Trump presidency. 
 
It’s an ongoing news reality saga designed to get ratings &amp; circulation:can the media bring down Trump?

https://t.co/JcP6uA6Zlo"
x23970102,BillOReilly,2018-11-16T11:00:02Z,x1063386202483511296,1994,399,"While the animus between Mr. Trump and the media is truly terrible, the truth is that most presidents loathed the press. In my lifetime, only John F. Kennedy was able to control the media and use it to his advantage--https://t.co/JcP6uA6Zlo"
x23970102,BillOReilly,2018-11-16T15:54:01Z,x1063460185505714176,17098,5721,"Bad ruling because it rejects the argument that standards of personal conduct should be respected on federal property. If the White House appeals, I believe it will prevail in the Supreme Court. https://t.co/11A49QqnO1"
x23970102,BillOReilly,2018-11-16T19:42:29Z,x1063517683424075776,1921,451,Bad ruling by a federal judge on the CNN- White House brawl.  Please check out the Message of the Day on https://t.co/rryWmyXe7C and we’ve posted my conversation about the ruling with @glennbeck on the radio this morning--https://t.co/iPXFR34x43
x23970102,BillOReilly,2018-11-17T13:00:00Z,x1063778782140452864,2698,667,"It remains to be seen if the judiciary understands that it is not journalism involved in the White House controversy but show business.  The old adage is: the show must go on.
 
Jim Acosta and his corporate masters really hope that will be the case—https://t.co/JcP6uA6Zlo"
x23970102,BillOReilly,2018-11-17T15:08:11Z,x1063811039530311680,3098,709,Far left Senator Kamala Harris wants to equate ICE with the KKK. More political insanity. Please check out sane news analysis on https://t.co/rryWmyXe7C.
