user_id,screen_name,created_at,status_id,favorite_count,retweet_count,text
x73303753,SenBobCorker,2018-06-20T21:24:32Z,x1009547573852626945,20,5,This is good news for self-employed individuals and the millions of Americans who work for small businesses. My full statement on this announcement: https://t.co/Pe5BzrqxCw. https://t.co/LQ3Wm279Gu
x73303753,SenBobCorker,2018-06-20T21:51:08Z,x1009554266124529665,437,45,"This week, I called on the administration to halt family separations, so I am glad the president reversed his position and signed an executive order. We will continue to work toward a long term solution."
x73303753,SenBobCorker,2018-06-20T21:52:50Z,x1009554695352922112,270,60,I believe pressure is building in Washington and across the country as American businesses and consumers begin to feel the effects of the administration’s misguided trade policy.
x73303753,SenBobCorker,2018-06-21T19:30:11Z,x1009881181645627392,45,13,"I think most Tennesseans would agree that we are fortunate not to have a state income tax, and to help ensure that remains the case, it is important our sales tax system works. Today’s ruling is a win for states’ rights. My full statement: https://t.co/0CMag8nhLe. https://t.co/wT8CHNewtI"
x73303753,SenBobCorker,2018-06-21T20:46:04Z,x1009900279741984769,53,15,I continue to believe that selling TVA’s transmission lines would be harmful to the Tennessee Valley and remains a very unlikely outcome. My statement on the administration's proposal to sell TVA transmission lines: https://t.co/AfN1MsK5zb.
x73303753,SenBobCorker,2018-06-21T20:59:21Z,x1009903624615550977,23,8,My statement on the administration’s proposal to wind down government-sponsored enterprises Fannie Mae and Freddie Mac: https://t.co/pZX2rf8yrb
x73303753,SenBobCorker,2018-06-23T19:19:47Z,x1010603343696351232,60,15,Looking forward to a good conversation with @margbrennan on trade and immigration tomorrow morning on @FaceTheNation. Hope you'll tune in. #FTN https://t.co/ArJwP2KYYg
x73303753,SenBobCorker,2018-06-24T14:28:58Z,x1010892541481414656,75,13,All set and ready to join @margbrennan on @FaceTheNation. Tune in around 10:30 a.m. ET for our discussion on trade and immigration. https://t.co/FY670nhAmf
x73303753,SenBobCorker,2018-06-25T23:47:51Z,x1011395577672855553,37,10,"In case you missed it, I joined @margbrennan on @FaceTheNation yesterday to discuss trade and immigration policy. Watch the full interview here: https://t.co/kxXLfsE3tp."
x73303753,SenBobCorker,2018-06-26T21:13:17Z,x1011719069131788289,29,6,Enjoyed welcoming 165+ Tennesseans to Capitol Hill this morning at our weekly constituent breakfast. Learn more at https://t.co/KNtBh0uEie. #TennesseeTuesday https://t.co/4590Yr9r6i
x73303753,SenBobCorker,2018-06-26T21:20:06Z,x1011720783922647041,295,118,More than 270 business and agriculture groups today sent a letter urging my colleagues to support legislation I authored with @SenToomey to require congressional approval of national security-designated tariffs. See the full list and read the letter here: https://t.co/YIiIvUUmSa. https://t.co/1ycDWxD72Z
x73303753,SenBobCorker,2018-06-27T18:45:21Z,x1012044228321521664,507,73,"Thank you, Justice Kennedy, for a lifetime of distinguished service. It is my hope that the president will quickly nominate a well-qualified individual who understands the importance of upholding the Constitution and applying the law in a fair and independent manner."
x73303753,SenBobCorker,2018-06-28T13:24:59Z,x1012325993980231680,408,115,"Tariffs are a tax on the American people. The harm being done to the U.S. economy, businesses and consumers will only get worse. We will continue to fight for a vote on the Corker-@SenToomey tariff amendment. My floor remarks yesterday: https://t.co/ByD3Rrw5Uz."
x73303753,SenBobCorker,2018-06-28T15:43:26Z,x1012360835220623361,24,9,"Legislation approved by the #SFRC on Tuesday will more effectively focus and centralize cyber diplomacy efforts at the State Department so we can work with our allies and partners to maintain a secure, reliable and open internet. My full statement: https://t.co/0ctxBsBQpl."
x73303753,SenBobCorker,2018-06-29T16:50:28Z,x1012740091217891329,38,9,.@LeBonheurChild continues to impact the lives of thousands of young people like Leeya by providing innovative care. Congratulations on being named a “Best Children’s Hospital” by @usnews for the eighth year in a row. https://t.co/pcEt2Hm3tr
x73303753,SenBobCorker,2018-07-02T15:03:17Z,x1013800284454379521,561,214,"As I travel throughout the Baltics this week in my role as chairman of the Senate Foreign Relations Committee, it is clear that Russia’s destabilizing behavior continues to impact the region."
x73303753,SenBobCorker,2018-07-04T13:11:54Z,x1014497029358317569,196,30,I know all Tennesseans join me as we celebrate Independence Day and give thanks for the privilege of living in the greatest country on Earth. My statement in honor of #IndependenceDay: https://t.co/Y9EhcTEBDz. https://t.co/WiHak75rz7
x73303753,SenBobCorker,2018-07-06T13:39:22Z,x1015228717273178114,778,207,"Yesterday, I returned from a trip to the Nordic and Baltic regions, where we met with U.S. and foreign officials in Sweden, Denmark, Latvia, and Finland to discuss political and security issues important to the United States. My full statement: https://t.co/ph0VzH7cUR"
x73303753,SenBobCorker,2018-07-10T01:18:00Z,x1016491696916443136,225,52,My statement on the nomination of Brett M. Kavanaugh to be the next U.S. Supreme Court justice: https://t.co/CiiSDRQDYY
x73303753,SenBobCorker,2018-07-11T14:18:43Z,x1017050559264821248,573,129,"The Senate will hold a test vote today on our efforts with @SenToomey, @JeffFlake and others to ensure Congress plays a role in the implementation of national security-designated tariffs. This is a good first step and will get the Senate on the record on this critical issue."
x73303753,SenBobCorker,2018-07-11T15:23:39Z,x1017066898410868736,110,25,Speaking about this shortly on the Senate floor. Watch at https://t.co/84Iw0WCwOG. https://t.co/0yhpJM3R7p
x73303753,SenBobCorker,2018-07-12T13:30:57Z,x1017400922610257920,17,13,"TUNE IN: At 10:00 a.m. ET, the #SFRC will hold a hearing on the implications of tariffs for U.S. foreign policy and the international economy. Assistant Secretary of State @manishasingh and former White House Chief of Staff Josh Bolten to testify. Watch: https://t.co/7uZLiq4yo1."
x73303753,SenBobCorker,2018-07-12T13:46:35Z,x1017404858276515840,189,19,"Yesterday, the Senate spoke loud and clear by overwhelmingly expressing support for our efforts to ensure Congress plays its appropriate role in the implementation of national security-designated tariffs."
x73303753,SenBobCorker,2018-07-12T20:25:24Z,x1017505223122804737,22,6,Paul Ney has worked for the state of Tennessee ably and well for many years. I was proud to wholeheartedly support his confirmation. My remarks earlier this year at a hearing on his nomination: https://t.co/3eLV8xeeJn. https://t.co/itd7ry8SjV
x73303753,SenBobCorker,2018-07-13T00:34:53Z,x1017568008485687301,79,21,Today’s announcement is outstanding news for the people of Jefferson County. Looking forward to @oshkoshcorp and 300 new jobs coming to East Tennessee. https://t.co/6yFb7NKt1G
x73303753,SenBobCorker,2018-07-17T14:35:49Z,x1019229187914289157,3044,488,"As I said yesterday, the Helsinki press conference was saddening and disappointing, and I am glad people on both sides of the aisle condemned it strongly."
x73303753,SenBobCorker,2018-07-17T14:37:19Z,x1019229564323745792,79334,22655,"The dam is finally breaking. Thankfully. 
 
As the president taxes Americans with tariffs, he pushes away our allies and further strengthens Putin. 
 
It is time for Congress to step up and take back our authorities. 
 
We have legislation to do that. Let’s vote."
x73303753,SenBobCorker,2018-07-18T13:41:31Z,x1019577911496585223,48,16,"This morning at 10:00 a.m. ET, the #SFRC will hold a hearing on the nominations for Under Secretary of State for Management and Assistant Secretary of State for Conflict and Stabilization Operations. Watch live: https://t.co/wvLAvdHgqd."
x73303753,SenBobCorker,2018-07-18T16:24:33Z,x1019618939398164480,68,7,It is hard to believe it has been 10 years this week since I received the call that @Volkswagen had chosen Chattanooga. My full statement: https://t.co/dbaO9vx0wk. https://t.co/1Ja1xobXpJ
x73303753,SenBobCorker,2018-07-18T22:12:35Z,x1019706526536257536,297,93,Our committee looks forward to hearing from @SecPompeo next Wednesday at 2:30 p.m. ET. You can watch live at https://t.co/S6dvnLHAP7.
x73303753,SenBobCorker,2018-07-19T23:21:16Z,x1020086195928338432,282,68,"I had a great meeting today with Judge Kavanaugh and think he is a superb nominee. I will certainly watch his confirmation hearing, but assuming there are no surprises there, I plan to enthusiastically support his nomination. My full statement: https://t.co/emh8i4FkSZ. https://t.co/hlFSHpKYcX"
x73303753,SenBobCorker,2018-07-20T15:29:35Z,x1020329881622728704,155,42,"Yesterday, we introduced bipartisan legislation demanding #Turkey end the unjust detention of U.S. citizens, including Pastor Andrew Brunson. Learn more here: https://t.co/Ym2VxooHPl. https://t.co/1UuUapb0w8"
x73303753,SenBobCorker,2018-07-24T18:42:31Z,x1021827986104963077,224,53,Senator @MikeCrapo and I worked closely together to write the Countering America’s Adversaries Through Sanctions Act and are eager to continue the important work being done by our committees to push back on Russia. Learn more about upcoming hearings here: https://t.co/dmKYEVbrsk.
x73303753,SenBobCorker,2018-07-25T18:01:57Z,x1022180165600915457,108,43,"Today at 3:00 p.m. ET, the #SFRC will hear testimony from @SecPompeo on the administration’s ongoing dialogue with North Korea, as well as the president’s recent meeting with Russian President Vladimir Putin. Watch live here: https://t.co/WlppKnertN."
x73303753,SenBobCorker,2018-07-25T21:22:40Z,x1022230679348813824,247,56,My opening statement at today’s #SFRC hearing with @SecPompeo: https://t.co/3dkq4h4bbO
x73303753,SenBobCorker,2018-07-26T13:45:12Z,x1022477941802971136,133,53,It’s long past time for Turkey to let Pastor Brunson come home and end its harassment and arbitrary detention of all U.S. citizens and embassy staff. I look forward to #SFRC consideration of TIFIA: https://t.co/kccabRbLej.
x73303753,SenBobCorker,2018-08-01T13:31:22Z,x1024648785438203905,25,11,"This morning at 10:00 a.m. ET, the #SFRC will review the nominations of Clarke Cooper to be an Assistant Secretary of State and John Richmond to be Director of the Office to Monitor and Combat Trafficking. Watch live: https://t.co/rXwSEGtCad."
x73303753,SenBobCorker,2018-08-10T19:33:35Z,x1028001430588858369,186,49,"Proud our office could play a small role in helping Tennessean Edgar Harrell, the last living Marine who was on the USS Indianapolis during World War II, receive a military promotion that was 73 years overdue. Learn about his incredible story and heroism: https://t.co/POIgs5cPSL."
x73303753,SenBobCorker,2018-08-16T13:54:03Z,x1030090314554458112,13,7,TUNE IN: This morning at 10:00 a.m. ET the #SFRC will hold a hearing to consider the nomination of David Hale to be Under Secretary of State for Political Affairs. Watch: https://t.co/Jq0Jcca0hE.
x73303753,SenBobCorker,2018-08-16T19:00:57Z,x1030167547948228613,380,47,Saddened to hear about the loss of Tennessee native Aretha Franklin. Her music and legacy has impacted countless lives from Memphis to Detroit and around the world. Our thoughts and prayers are with her family during this time.
x73303753,SenBobCorker,2018-08-21T13:25:16Z,x1031895009983950848,104,55,"This morning at 10:00 a.m. ET, the #SFRC will hold its second in a series of hearings on U.S.-Russia relations. Watch live at https://t.co/S6dvnLHAP7."
x73303753,SenBobCorker,2018-08-26T02:04:11Z,x1033535549011845120,2428,281,America lost a statesman and hero tonight and all of us in the Senate lost a friend. My full statement on @SenJohnMcCain: https://t.co/piOcIYCjwN
x73303753,SenBobCorker,2018-08-30T18:54:02Z,x1035239237396914176,47,12,Stan Brock helped improve the lives of hundreds of thousands of Americans through @ramusaorg. I am sad to learn of his passing but thankful that he devoted his life to helping people in need. It was an honor to join him in Ooltewah in 2014: https://t.co/ps8S6XGJqm
x73303753,SenBobCorker,2018-08-30T22:46:53Z,x1035297834608873473,10623,1033,".@SenJohnMcCain was a patriot and was in service to our country his entire life. We’re going to miss him, but it was an honor to be in Phoenix today to celebrate his remarkable life. Thank you to the McCain family for sharing him with us over the years."
x73303753,SenBobCorker,2018-09-03T19:34:24Z,x1036698945089662976,502,166,Imprisoning Wa Lone and Kyaw Soe Oo further tarnishes the already failing leadership of Aung San Suu Kyi and harms Burma’s democracy as atrocities continue to be carried out against the Rohingya minority. The U.S. must continue to stand up for press freedoms at home and abroad. https://t.co/2GnNvQLg0j
x73303753,SenBobCorker,2018-09-05T13:55:19Z,x1037338391363428352,77,24,"This morning at 10:00 a.m. ET, the #SFRC will hold its third in a series of hearings on Russia, focusing today on the value of the North Atlantic Treaty Organization. Watch live: https://t.co/Gn9CapoovM."
x73303753,SenBobCorker,2018-09-05T20:45:06Z,x1037441513775620097,340,31,"My friend Jon Kyl is one of the most knowledgeable members I have served with in the Senate, and I was glad to welcome him back today. He was a great choice to fill @SenJohnMcCain’s seat and represent the people of Arizona."
x73303753,SenBobCorker,2018-09-05T22:09:26Z,x1037462736119234561,150,31,"During our third in a series of hearings on U.S.-Russia relations, we tried to set the record straight about the importance of @NATO after the value of this critical alliance has been repeatedly questioned. Watch my full remarks from today's hearing: https://t.co/91NdDo0uIy."
x73303753,SenBobCorker,2018-09-11T19:46:33Z,x1039601106517680131,488,59,"While September 11 is a somber day for all Americans, it is important we remember the innocent lives that were lost and pay tribute to the brave first responders and military service members who answered the call of duty. #NeverForget"
x73303753,SenBobCorker,2018-09-14T20:26:58Z,x1040698441054257154,75,19,"Great to be downtown Chattanooga today for the grand opening of Miller Park. Congratulations to Mayor @andyberke, @RiverCityCo and all those involved in this outstanding project. #MillerParkCHA #CHA https://t.co/cXl4HYLNAb"
x73303753,SenBobCorker,2018-09-18T14:17:39Z,x1042055051139862531,29,15,"LIVE NOW: The #SFRC is holding the fourth in a series of hearings on Russia, focusing today on the status of U.S.-Russia arms control efforts. Livestream: https://t.co/7SeJDtjEWV."
x73303753,SenBobCorker,2018-09-18T14:19:58Z,x1042055633820901376,86,21,I thank @SenAlexander for his leadership on this legislation and applaud the Senate for coming together in a bipartisan manner to help countless Americans who have been impacted by this crisis. My full statement on the #OpioidCrisisResponse Act: https://t.co/3eZeub0QSV. https://t.co/6R57xXpa8y
x73303753,SenBobCorker,2018-09-19T02:13:44Z,x1042235261713829888,45639,15076,"After learning of the allegation, Chairman @ChuckGrassley took immediate action to ensure both Dr. Ford and Judge Kavanaugh have the opportunity to be heard, in public or private. Republicans extended a hand in good faith. If we don’t hear from both sides on Monday, let’s vote."
x73303753,SenBobCorker,2018-09-19T20:56:12Z,x1042517738898509824,160,55,I appreciate the work of @senorrinhatch and @SenAlexander and have been proud to work with them on this effort. I am hopeful the House will send our legislation to the president’s desk to be signed into law. My statement: https://t.co/uTPrb6TfkY. #StandWithSongwriters https://t.co/bOJ290JXzJ
x73303753,SenBobCorker,2018-09-21T18:22:33Z,x1043203844677742592,96,20,"Sponsoring #ConstitutionWeek events over the past 11 years has been incredibly rewarding for our office, and I hope the students who have participated have walked away recognizing what a blessing it is to live in the greatest country on Earth. https://t.co/e75UOBTEBH"
x73303753,SenBobCorker,2018-09-21T20:04:00Z,x1043229377675317254,88,19,A big thanks to the nearly 500 @DiscoveryIncTV employees volunteering in Knox County today. Appreciate them using their Impact Day to lend a helping hand in the community with organizations like Rebuild Together Knoxville and @bgctnv. https://t.co/3dNBkAEUuv
x73303753,SenBobCorker,2018-09-25T14:06:46Z,x1044589027029110784,111,32,The Sam Farr and Nick Castle Peace Corps Reform Act of 2018 is now on its way to the president’s desk to be signed into law. I am encouraged that with these reforms we will strengthen the @PeaceCorps in Nick Castle’s memory. Learn more: https://t.co/itAk4896dd.
x73303753,SenBobCorker,2018-09-26T21:05:27Z,x1045056781574184961,151,38,"Today the #SFRC passed our bill to extend @PEPFAR for another five years. For more than 15 years, PEPFAR has saved millions of lives by beginning to reverse the devastation of HIV/AIDS through targeted treatment and prevention. Read more: https://t.co/PrR9nYGX54."
x73303753,SenBobCorker,2018-09-28T00:49:03Z,x1045475440528412678,52345,12886,I plan to vote to confirm Judge Brett Kavanaugh. My full statement: https://t.co/LDj4epYyhc
x73303753,SenBobCorker,2018-09-28T12:47:17Z,x1045656188371828736,331,58,Phil Trenary was a true champion for Memphis. I am thankful for his contributions and for the example he has shown to so many through his public service. I am saddened to learn of his untimely death.
x73303753,SenBobCorker,2018-09-28T21:29:37Z,x1045787638349869056,973,184,This is a reasonable agreement and should bring additional clarity to the final vote. https://t.co/yrCboRMlQp
x73303753,SenBobCorker,2018-10-04T12:55:15Z,x1047832521680011264,230,66,Glad that our bill with @ChrisCoons to promote economic growth in developing countries through U.S. business investment while saving taxpayers $20 million will now become law. Learn more about the #BUILDAct: https://t.co/3yLAdeNqWU.
x73303753,SenBobCorker,2018-10-04T16:11:35Z,x1047881931877224448,14081,3856,The supplemental background investigation found absolutely zero corroboration of the allegations that have been made. I plan to vote for Judge Kavanaugh and believe he will be confirmed very soon.
x73303753,SenBobCorker,2018-10-05T13:23:31Z,x1048202023940841472,33420,10961,"Transferring the countless injustices that have happened to women for decades onto a person who had nothing to do with them is an injustice, just as seeking to elevate one’s own political stature by wrongly destroying someone else’s reputation is an injustice."
x73303753,SenBobCorker,2018-10-05T21:26:31Z,x1048323572056375297,105,29,Glad the #BUILDAct has been signed into law. This effort will begin to move us away from providing direct assistance with mixed results and instead help countries become more self-reliant. https://t.co/B63ZieUfpd
x73303753,SenBobCorker,2018-10-06T20:18:55Z,x1048668948928122881,560,68,I spoke with @DanaPerino and @BillHemmer on @FoxNews ahead of this afternoon’s vote to #ConfirmKavanaugh. Watch here: https://t.co/336vjh5mwa
x73303753,SenBobCorker,2018-10-08T17:50:09Z,x1049356286847016966,4511,1333,"Our thoughts are with #JamalKhashoggi’s family and colleagues at the @washingtonpost. I have raised Jamal's disappearance personally with the Saudi ambassador, and while we await more information, know we will respond accordingly to any state that targets journalists abroad."
x73303753,SenBobCorker,2018-10-09T00:00:20Z,x1049449444629012480,4715,5501,"Today in Venezuela, Fernando Albán, a young opposition leader, died while in the government’s custody. This is disturbing and the government has a responsibility to ensure all understand how that could have happened."
x73303753,SenBobCorker,2018-10-09T19:01:35Z,x1049736650593579008,277,41,".@nikkihaley has been a fierce advocate for U.S. interests during her time as U.N. ambassador. While I hated to hear of her departure, I have enjoyed working with her and am thankful for her willingness to serve."
x73303753,SenBobCorker,2018-10-10T22:00:11Z,x1050143986751627264,744,336,"Today, we sent a letter to the administration triggering an investigation and Global Magnitsky sanctions determination regarding the disappearance of Saudi journalist and @washingtonpost columnist #JamalKhashoggi. https://t.co/reqXtmqfJt"
x73303753,SenBobCorker,2018-10-11T21:45:31Z,x1050502681507352577,403,105,Pleased @POTUS signed the #MusicModernizationAct into law. I thank @SenAlexander and @senorrinhatch for their leadership on this issue and have been proud to work with them to make this a reality. My statement: https://t.co/yu6MzVLyqR. #StandWithSongwriters https://t.co/UQReWgceaE
x73303753,SenBobCorker,2018-10-11T23:14:02Z,x1050524956323401729,116,30,Honored to have recommended Eli Richardson for the position of U.S. District Court Judge for the Middle District of Tennessee. Glad his confirmation will help alleviate the high caseload. My statement: https://t.co/ladzJ2dgY9.
x73303753,SenBobCorker,2018-10-11T23:18:43Z,x1050526136114003968,93,23,".@senatornorris has long been a devoted public servant in Tennessee, and I am pleased he will continue to serve our state as a federal district court judge. I congratulate him on his confirmation. My statement: https://t.co/6n1qhMuCf8."
x73303753,SenBobCorker,2018-10-12T17:45:34Z,x1050804685215555584,210,51,"This has been a long and painful ordeal for Pastor Andrew Brunson and his family, and we are relieved that they will finally be reunited after this long period of his unjust imprisonment. My full statement on his release from Turkey today: https://t.co/4ecCqZ7BEy"
x73303753,SenBobCorker,2018-10-18T22:58:36Z,x1053057788090478592,580,76,"In light of the circumstances, Treasury Secretary Mnuchin did the right thing in not going to the Saudi investment summit. https://t.co/mg1SRjapbJ"
x73303753,SenBobCorker,2018-10-19T18:26:24Z,x1053351675510042624,83,24,"Sad to hear of the passing of Lacy Upchurch. A lifelong farmer, he understood the importance of Tennessee’s agriculture community and represented the @TNFarmBureau for a decade with dedication and commitment. My thoughts are with his wife, Kay, and his family."
x73303753,SenBobCorker,2018-10-20T02:08:28Z,x1053467959681789954,4989,1239,"The story the Saudis have told about Jamal Khashoggi’s disappearance continues to change with each passing day, so we should not assume their latest story holds water."
x73303753,SenBobCorker,2018-10-24T20:23:58Z,x1055193202930737152,58,16,"By taking a multifaceted approach, we can responsibly help combat this increasingly devastating problem. I thank @SenAlexander for his leadership on this issue and am pleased the president has signed this legislation into law. Learn more: https://t.co/YDRcU8mBpX. https://t.co/62qtjICPbH"
x73303753,SenBobCorker,2018-10-27T23:11:50Z,x1056322609384747008,934,141,Horrified by the deadly act of violence inspired by hate at a synagogue in Pittsburgh earlier this morning.
x73303753,SenBobCorker,2018-11-03T20:13:50Z,x1058814529981812742,115,16,It’s a beautiful weekend for the @HeadoftheHooch. Glad to have so many folks in Chattanooga for one of the world’s largest rowing regattas. Congratulations to all of the participants! https://t.co/SwKo0y8a6o
x73303753,SenBobCorker,2018-11-05T20:02:36Z,x1059536477498028037,82,18,My statement on the administration’s re-imposition of #Iran sanctions: https://t.co/U0UpWiM43a
x73303753,SenBobCorker,2018-11-07T02:45:39Z,x1060000298465460224,372,74,Congratulations to Bill Lee and Marsha Blackburn on being elected to represent the people of Tennessee. My full statement on their victories: https://t.co/W6c5plXDq4
x73303753,SenBobCorker,2018-11-11T19:56:59Z,x1061709390959521792,281,34,Veterans represent the very best of our nation. Their service and sacrifice have helped ensure America remains the greatest country on Earth. I know all Tennesseans join me today in thanking these brave men and women for protecting our freedoms. #VeteransDay https://t.co/aRhSemrXBk
x73303753,SenBobCorker,2018-11-13T22:12:58Z,x1062468390663675912,196,39,"With this being the single largest jobs announcement in state history, it is clear that Tennessee is firing on all cylinders. My full statement on today's announcement by @amazon: https://t.co/VlLcbfACy4. https://t.co/5Xn8ZzyPZ6"
x73303753,SenBobCorker,2018-11-13T22:16:57Z,x1062469393706303488,58,17,"It’s one job announcement after another in Tennessee today, and yet another example of a global company establishing a major presence in the Volunteer State. Proud to welcome @EYnews to Nashville. https://t.co/WwPUL2YPAN"
x73303753,SenBobCorker,2018-11-14T17:24:36Z,x1062758205829402624,36,7,I thank Bill Johnson for his service to @TVAnews and look forward to continued strong leadership from the next president and CEO. My full statement on Bill's retirement: https://t.co/4xXrij3NPe
x73303753,SenBobCorker,2018-11-15T21:05:12Z,x1063176110026952705,322,126,"I have a lot of concerns about the trajectory that Saudi Arabia is on right now, and I think a price needs to be paid. My full statement on the Global Magnitsky sanctions against Saudi officials for the murder of #JamalKhashoggi: https://t.co/EEM0HzGgwg"
x73303753,SenBobCorker,2018-11-17T14:12:04Z,x1063796917581344768,22661,7461,"Everything points to the Crown Prince of Saudi Arabia, MbS, ordering @washingtonpost journalist Jamal #Khashoggi's killing. The Trump administration should make a credible determination of responsibility before MbS executes the men who apparently carried out his orders."
