user_id,screen_name,created_at,status_id,favorite_count,retweet_count,text
x202206694,SenJohnBarrasso,2018-08-19T00:37:15Z,x1030976954328080384,46,8,Bobbi and I enjoyed celebrating the grand opening of the High Altitude Performance Center and reopening of the Rochelle Athletic Center at the University of Wyoming. Glad to see our #UWYO student athletes have access to state of the art training facilities. #OneWyoming #GoWyo https://t.co/xrvzVV6zT7
x202206694,SenJohnBarrasso,2018-08-19T20:03:38Z,x1031270484023885824,44,15,It was a privilege to thank so many veterans at this weekend's Rocky Mountain Elk Foundation banquet in Gillette. Bobbi and I appreciate your willingness to serve our country. https://t.co/xEIqPel5wW
x202206694,SenJohnBarrasso,2018-08-21T15:59:12Z,x1031933746260402176,38,19,"The so-called ""Clean Power Plan"" would have cost Wyoming’s energy workers their jobs &amp; devastated communities. The Obama-era regulation wasn’t just bad policy, it was illegal. Glad the Trump admin is focused on getting this punishing rule off the books. https://t.co/r2R52V7SAu"
x202206694,SenJohnBarrasso,2018-08-25T00:51:36Z,x1033154893580824576,10,4,"Great day in Cheyenne at the Wyoming Trauma Conference and visiting local businesses. And thank you to @kgwntv for having me on the show tonight to talk about my visit, health care and other issues important to Wyoming. https://t.co/P9ZMZa5TXT"
x202206694,SenJohnBarrasso,2018-08-26T01:45:08Z,x1033530753559285761,63,22,"America has lost a true hero today. John McCain was a man of the highest character, courage and credibility. He was the conscience of the Senate. He was also my friend. https://t.co/xV6n2K2TFK https://t.co/IeGZ7rAtAP"
x202206694,SenJohnBarrasso,2018-08-29T17:12:21Z,x1034851260241993730,23,12,"I recently paid tribute to my late friend and colleague @SenJohnMcCain on the Senate floor. He was a man of the highest character, courage, and credibility. He leaves a legacy of unquestioned devotion and love for his country and his family. https://t.co/3RlTgXa9hB"
x202206694,SenJohnBarrasso,2018-08-29T20:44:50Z,x1034904733381734401,12,7,The US Int’l Trade Commission voted to end harmful tariffs on imported newsprint. This is great news for @WyoPress &amp; newspapers across Wyoming who were hurt by these tariffs. Now they can renew their focus on keeping communities informed and up to date. https://t.co/QAQREhzjkz
x202206694,SenJohnBarrasso,2018-09-02T02:03:17Z,x1036072036316209152,50,7,It’s always great to be in Laramie for the first home @Wyo_Football game of the year. Looking forward to cheering on the cowboys the rest of the season. #GoWyo #OneWyoming https://t.co/0IVHbAzDNg
x202206694,SenJohnBarrasso,2018-09-03T17:38:18Z,x1036669730772402176,24,8,Bobbi and I had a great time celebrating Labor Day in Meeteetse this morning. The pancake breakfast and parade bring in folks from around the state. #LaborDay #Wyoming https://t.co/9OwvgY7G9g
x202206694,SenJohnBarrasso,2018-09-07T23:02:55Z,x1038200972919619585,18,5,"Was good to stop by Lee’s Glass to celebrate 65 years of business in Casper and the retirement of Lee’s son, Rip Santoni. https://t.co/HaUVnsVB3h"
x202206694,SenJohnBarrasso,2018-09-08T23:30:48Z,x1038570376794697728,65,22,The Rawlins Great Divide Friends of the NRA put on a great event this afternoon at the fairgrounds. Glad to see such strong support for our Second Amendment rights. https://t.co/0QbLinQUuH
x202206694,SenJohnBarrasso,2018-09-10T00:25:11Z,x1038946453509550080,23,5,"Bobbi and I spent the day in Teton County at the 35th annual Moran Volunteer Firefighters BBQ and the Jackson Rotary Supper Club silent auction ""Sips on the Square."" Wonderful to see so many folks show up to both events and support two worthy causes. https://t.co/7Rc2NCS313"
x202206694,SenJohnBarrasso,2018-09-11T14:11:34Z,x1039516808095694848,28,12,Today we honor and remember all who lost their lives on this day 17 years ago. #NeverForget #September11th https://t.co/KE72k9V8pK
x202206694,SenJohnBarrasso,2018-09-11T19:10:31Z,x1039592037417406464,24,16,"Congress has reached an agreement on bipartisan water infrastructure legislation. America’s Water Infrastructure Act will create jobs, cut red tape, &amp; keep communities safe. It’s a major down payment on @realDonaldTrump’s call to fix our infrastructure https://t.co/4dFWWPrBYx https://t.co/ihnwoar8jG"
x202206694,SenJohnBarrasso,2018-09-12T21:17:08Z,x1039986291654438914,32,15,Spoke on the floor today about why America needs Judge Brett Kavanaugh on the Supreme Court. #SCOTUS https://t.co/vQdR9MEzSS
x202206694,SenJohnBarrasso,2018-09-15T14:59:54Z,x1040978522964152321,27,7,"Wonderful to be a part of yesterday's celebration of @BLMWyoming acquisition of 646 acres of land near Casper, including 1.5 miles along North Platte River. The Rim Rock project will expand recreational opportunities &amp; preserve an important historic &amp; cultural part of our state. https://t.co/OdqcFCaq1r"
x202206694,SenJohnBarrasso,2018-09-17T13:34:11Z,x1041681726261608448,20,15,#ICYMI: Wrote an op-ed about Republicans providing alternatives to #ObamaCare that lower costs for families &amp; protect people from catastrophic medical bills.  https://t.co/gwYJlTO6Sm
x202206694,SenJohnBarrasso,2018-09-17T13:35:09Z,x1041681970693058561,16,9,"The first rule change expands access to “short-term” health plans, &amp; the second allows more people to join “association” health plans. Combined, these two changes are likely to provide more affordable insurance to 8 million Americans. https://t.co/Br6YhZXd2Q"
x202206694,SenJohnBarrasso,2018-09-17T17:04:50Z,x1041734739273678850,13,5,It was an honor to be a part of the ribbon cutting for the new #UWYO Campus Veterans Services Center on Friday. Wyoming's veterans deserve nothing but the best. I'm pleased they will now have access to this incredible facility. https://t.co/4TdNG3Zq86
x202206694,SenJohnBarrasso,2018-09-17T17:39:47Z,x1041743530866171910,34,23,#OTD 231 years ago our nation’s Constitution was ratified.  #ConstitutionDay https://t.co/rBsv0d63RZ
x202206694,SenJohnBarrasso,2018-09-17T22:55:28Z,x1041822978374361091,39,18,The Senate just passed bipartisan legislation that I cosponsored to make it easier for patients to know if they’re paying the lowest price for their prescription medication. https://t.co/e2eKK62DwH
x202206694,SenJohnBarrasso,2018-09-18T17:43:02Z,x1042106739292864512,11,5,"Happy 71st birthday to the @usairforce. We’re grateful for the airmen at F.E. Warren Air Force Base, the WY Air National Guard and all the brave men &amp; women who protect our nation. #AFBDay https://t.co/pmU9npE0cq"
x202206694,SenJohnBarrasso,2018-09-21T17:52:26Z,x1043196269240430592,25,11,"Great to see my friends Pete Simpson and Dr. Sloan Hales last night in Cheyenne celebrating Laramie County Community College's 50th anniversary. Since 1968, @LCCC has provided thousands of students the opportunity to further their education &amp; expand their career opportunities. https://t.co/VyGbBIg7Px"
x202206694,SenJohnBarrasso,2018-09-22T16:45:03Z,x1043541697903452160,35,13,Happy 25th annual National #PublicLandsDay. Enjoy free access into one of the incredible national parks in Wyoming or spend time on some of our beautiful BLM and National Forest Service lands. #NPLD https://t.co/8YWapzBFog
x202206694,SenJohnBarrasso,2018-09-24T13:36:26Z,x1044219005836382208,132,36,"On this day in 1906, President Teddy Roosevelt designated Devils Tower the first US National Monument. #WyoHistory https://t.co/wKMURjzmxW"
x202206694,SenJohnBarrasso,2018-09-25T21:42:58Z,x1044703832721240064,53,18,Congratulations to @Fremont1_LVHS principal Brad Neuendorf on being named the 2018 Wyoming Principal of the Year. Thanks for all you do to help students in #Wyoming receive a quality education. https://t.co/HzIsDa8lqz
x202206694,SenJohnBarrasso,2018-09-29T23:51:04Z,x1046185621860028416,36,9,It's always great to be in Laramie on game day. Happy to root for @Wyo_Football as they take on Boise State. #OneWyoming #GoWyo https://t.co/5geCE0cgV2
x202206694,SenJohnBarrasso,2018-09-30T22:29:20Z,x1046527440581988353,45,18,"Had a great time in Sweetwater County this weekend celebrating the 150th anniversary of Green River and the Transcontinental Railroad. Thanks to everyone, especially the Green River Chamber of Commerce, who worked hard to make it such a memorable event. https://t.co/OFuYYClCsa"
x202206694,SenJohnBarrasso,2018-10-01T22:22:20Z,x1046888069713076224,92,26,"Since day one, @realDonaldTrump &amp; his trade team have promised to level the playing field for American families, workers, &amp; businesses. The new modernized trade agreement w/ Canada &amp; Mexico represents a major step toward fulfilling that promise. #USMCA"
x202206694,SenJohnBarrasso,2018-10-02T17:13:00Z,x1047172610453331969,17,12,Proud to receive the Taxpayers’ Friend Award again. https://t.co/yzktDVnoMl
x202206694,SenJohnBarrasso,2018-10-06T20:12:27Z,x1048667320124620801,207,54,"For the second time in two years, the Senate has confirmed a highly qualified judge to sit on the U.S. Supreme Court. Despite attempts to smear his good name, Judge Kavanaugh has proven himself to be a mainstream, independent judge. #SCOTUS"
x202206694,SenJohnBarrasso,2018-10-08T19:11:02Z,x1049376642395774976,36,10,It was wonderful to be in Powell earlier today to visit with and congratulate students and staff at Westside Elementary on being named a 2018 @NatlBlueRibbon school. This is a well-deserved honor for these outstanding students and educators. #Wyoming  #NBRS2018 https://t.co/jdNkl2e5eO
x202206694,SenJohnBarrasso,2018-10-09T23:53:37Z,x1049810142022242304,26,14,America’s Water Infrastructure Act will have a real impact in our rural communities and our big cities. It will help the heartland and the coasts. The Senate should pass this bipartisan bill tomorrow and send it to @POTUS for his signature. https://t.co/6hjoDZLtey
x202206694,SenJohnBarrasso,2018-10-10T01:38:10Z,x1049836453021274113,97,18,Our nation is grateful for the strong leadership and dedication of Ambassador @NikkiHaley. She has fiercely advocated for American values and ideals around the world. America and our allies are safer thanks to her service.
x202206694,SenJohnBarrasso,2018-10-10T13:55:59Z,x1050022132418260992,14,12,"America's Water Infrastructure Act:

📈 Grows the economy and creates jobs
✂️ Cuts red tape for water #infrastructure projects
🏡 Keeps communities safe from floods &amp; droughts and by providing clean drinking water

Learn how it will help your community: https://t.co/PcioqitHaw https://t.co/nxEiKQgzpN"
x202206694,SenJohnBarrasso,2018-10-10T15:02:25Z,x1050038852126208001,28,18,"America's Water Infrastructure Act, which the Senate will vote on today, answers @realDonaldTrump's call to fix the nation's water #infrastructure. It authorizes the construction &amp; expedition of more than 100 water resource projects. https://t.co/LGOzJv6Es6"
x202206694,SenJohnBarrasso,2018-10-10T16:34:14Z,x1050061956063944704,25,16,Thanks to @SenatorCarper and my fellow senators for supporting America’s Water Infrastructure Act. I am pleased to send this important bill to @realDonaldTrump for his signature. https://t.co/CE8obtT15D
x202206694,SenJohnBarrasso,2018-10-10T19:29:08Z,x1050105973812146181,63,20,Passing major water infrastructure legislation has united the Senate. Infrastructure is something we agree on. I am proud to send America’s Water Infrastructure Act to President @realDonaldTrump for his signature. https://t.co/gmVptVCHP6
x202206694,SenJohnBarrasso,2018-10-11T20:04:04Z,x1050477150523011072,29,10,"Toured Wyoming's Hoback Ranches community earlier this week which recently suffered huge losses due to the Roosevelt Fire. Thank you to all of the local, state and federal firefighters and first responders who face enormous risks daily to save lives and property. https://t.co/WEsxeAG65C"
x202206694,SenJohnBarrasso,2018-10-19T17:58:06Z,x1053344551883194368,13,6,Enjoyed visiting with Kelly Walsh High School history and government students and Model UN participants the past two days. They asked in-depth questions ranging from foreign policy to opportunities for young people in Wyoming. https://t.co/McLItvSViY
x202206694,SenJohnBarrasso,2018-10-20T20:50:22Z,x1053750293928820739,27,4,"Bobbi and I had a wonderful time at UW’s Homecoming this year. We celebrated distinguished alumni, including Mary Ellbogen Garland, who received the Medallion Service Award. We also met her grandson, Kai Keller Garland, Wyoming’s newest cowpoke and fan. #GoPokes https://t.co/6RCkY3D5e1"
x202206694,SenJohnBarrasso,2018-10-23T18:48:35Z,x1054806808676720640,107,47,On my way to the White House to watch President @realDonaldTrump sign our bipartisan America’s Water Infrastructure Act into law. This is a big win for Wyoming and the country. #infrastructure https://t.co/O7NUG0ylzo
x202206694,SenJohnBarrasso,2018-10-23T22:37:53Z,x1054864515228225542,75,37,Honored to be at White House today when Pres. @realDonaldTrump signed our bipartisan America’s Water Infrastructure Act into law. 📸: Official White House Photo by Shealah Craighead https://t.co/nGeKb4Opug https://t.co/ecgy4Zceie
x202206694,SenJohnBarrasso,2018-10-24T16:02:50Z,x1055127487494189058,34,24,"America’s Water #Infrastructure Act is a win for all Americans, and I am pleased President @realDonaldTrump has signed it into law. https://t.co/hLrsNGuWRW"
x202206694,SenJohnBarrasso,2018-10-24T17:02:25Z,x1055142480767795200,14,3,"Congratulations to Laramie's Snowy Range Academy on its selection as a 2018 @NatlBlueRibbon school. This award is a direct reflection of the dedication and hard work of your students, educators and parents. #NBRS2018 https://t.co/bg4ZAWibsv"
x202206694,SenJohnBarrasso,2018-10-24T21:19:36Z,x1055207203366494214,34,16,Today’s attempted attacks against multiple public officials and the media have absolutely no place in our society. Grateful for the brave actions of the Secret Service and law enforcement officials.
x202206694,SenJohnBarrasso,2018-11-02T22:58:25Z,x1058493559656062976,28,6,There was a lot to celebrate in Cheyenne today: the beginning of Kari Jo Gray's service as a Wyoming Supreme Court justice and the groundbreaking for a new kitchen for Cheyenne Meals On Wheels. #Wyoming https://t.co/qhe4f2pt3Q
x202206694,SenJohnBarrasso,2018-11-03T19:15:40Z,x1058799891500154880,35,7,Bobbi and I are enjoying being in Laramie today to cheer on @Wyo_Football as they take on San Jose State. #GoWyo #OneWyoming https://t.co/xwMUM7KMR3
x202206694,SenJohnBarrasso,2018-11-08T20:09:49Z,x1060625459266940928,34,10,"Proud to be named a Friend of the Farm Bureau. Todd, Cole and the entire agricultural community play a critical role in keeping Wyoming strong. https://t.co/pb1FvnRZD6"
x202206694,SenJohnBarrasso,2018-11-09T17:27:53Z,x1060947093517406209,17,9,Joined Al and Ann Simpson along with @GovMattMead last night in witnessing Bobbi Overfield’s swearing-in ceremony as district court judge of the Fifth Judicial District in Thermopolis. https://t.co/LanErmMLys
x202206694,SenJohnBarrasso,2018-11-09T21:48:18Z,x1061012629685190657,13,4,"The @wyowool is hosting the West Central States Wool Growers Convention this year. Had a great discussion this morning about the Endangered Species Act modernization, water infrastructure, and the Farm Bill. https://t.co/vKOki0GH21"
x202206694,SenJohnBarrasso,2018-11-11T15:53:13Z,x1061648046629535744,24,3,"#OTD 100 years ago the Great War ended. Today and every day, we are grateful for the men and women who have valiantly served our country. #VeteransDay https://t.co/Gykp2iWysi"
x202206694,SenJohnBarrasso,2018-11-11T19:44:53Z,x1061706346779869186,32,4,"On this 100th #VeteransDay, we’re grateful for all those who have served our country. I had the honor of attending ceremonies in both Douglas and Casper today. It’s always wonderful to see Wyoming communities come together to celebrate our veterans. #VeteransDay2018 https://t.co/2cxIEN5Nvz"
x202206694,SenJohnBarrasso,2018-11-13T21:10:27Z,x1062452657103818754,24,7,"Joined @GovMattMead yesterday at his final enlistment ceremony as governor. Since 2011, we’ve recognized 3,035 young enlistees. Thanks to Gov Mead &amp; his military advisor Judge Gary Hartman for recognizing the incredible young men &amp; women who have answered the call to serve. https://t.co/GLFhS4MSxg"
x202206694,SenJohnBarrasso,2018-11-14T17:29:04Z,x1062759330645245953,83,22,It’s an honor to be elected chairman of the Senate Republican Conference. I’m grateful for this new role and look forward to working with the Conference &amp; the administration on solutions to the challenges facing Wyoming &amp; the West. https://t.co/p1Cp5BNCfx
x202206694,SenJohnBarrasso,2018-11-15T21:01:05Z,x1063175074377818113,22,7,Thanks to @SenBennetCO &amp; @DougJones for joining me in introducing bipartisan legislation today to tackle chronic wasting disease in deer and elk. https://t.co/MO6bDNP1LY
x202206694,SenJohnBarrasso,2018-11-16T19:39:01Z,x1063516811625463810,14,8,Casper is hosting both the Wyoming Women in Agriculture Conference &amp; the Wyoming School Board Association today. It’s wonderful to see so many leaders who are passionate about keeping our Ag communities strong &amp; providing young people in Wyoming with a quality education. https://t.co/cW2W8y93sv
