user_id,screen_name,created_at,status_id,favorite_count,retweet_count,text
x26103389,BillHaslam,2018-09-27T20:03:11Z,x1045403500484743169,167,31,"In the fight against Alzheimer’s, @WeBackPat is doing groundbreaking research in honor of one of Tennessee's most legendary leaders. @CrissyHaslam and I thank Peyton Manning, Archie Manning and @LukeBryanOnline for helping us raise funds and awareness for this important work. https://t.co/CjHqhu9KVT"
x26103389,BillHaslam,2018-09-28T03:39:03Z,x1045518223171624960,258,73,Our hearts are broken with the news of the loss of Phil Trenary. Phil has been a wonderful friend to Crissy and me and a great advocate for Memphis. Our hearts go out to his family and his associates and the Memphis community.
x26103389,BillHaslam,2018-10-04T20:45:53Z,x1047950959136178178,250,60,"Tennessee’s history is America’s history, and now our stories are being told in the brand new @tnstatemuseum. Today we opened this world class museum showcasing our history in a way Tennesseans can be proud of and enjoy for generations to come. #ThreeStars #ThousandsofStories https://t.co/Hz0tCaVDaU"
x26103389,BillHaslam,2018-10-05T19:30:30Z,x1048294378169651200,146,39,"Here in Tennessee, we make things. On this #ManufacturingDay, let's thank our state’s manufacturers for creating high-quality jobs for thousands of Tennesseans, and our skilled workforce who are the heart and soul of Tennessee’s industries. I’m proud of what they do. #MFGDay18 https://t.co/wkNvCtGtrs"
x26103389,BillHaslam,2018-10-08T20:40:32Z,x1049399166366027777,71,13,"Healthy kids are more confident and have greater self-esteem, so I am grateful to Jake Steinfeld and @NatGovFit for bringing the DON’T QUIT! Fitness Campaign to TN and opening fitness centers at schools in Memphis, Pikeville and Sevierville. Thanks for helping our kids stay fit! https://t.co/OWxjMfX3X1"
x26103389,BillHaslam,2018-10-11T23:44:41Z,x1050532670344765440,237,43,"Mark Norris has made Tennessee a better place as senate majority leader and he will continue to do so as a federal judge for West Tennessee. Personally, I thank  @senatornorris for carrying our legislation these last eight years and for his great public service to our state."
x26103389,BillHaslam,2018-10-12T19:02:29Z,x1050824040632516608,76,27,"Colleen Conway-Welch was an innovator in the nursing profession, an advocate for women's health, a respected academic leader and a dear friend. Crissy and I will miss Colleen’s grace, compassion and generosity to us and the impact she made here and across the U.S. in health care."
x26103389,BillHaslam,2018-10-16T20:33:29Z,x1052296493837836289,118,34,"I got my flu shot and encourage all Tennesseans to do the same. Flu vaccination can reduce illness, doctor visits and missed school and work due to the flu. Protect yourself and others from the flu this season by stopping by your doctor’s office or local clinic for a flu shot. https://t.co/DJzLRBYd2O"
x26103389,BillHaslam,2018-10-22T17:11:07Z,x1054419892940820480,71,21,The work of TN State Government doesn’t start at 9 and end at 5. State employees are #servingTNatallhours to provide services and get the job done for their fellow Tennesseans – no matter the time of day. Check out their incredible stories here: https://t.co/8SqQ4Zw45h
x26103389,BillHaslam,2018-10-22T21:18:03Z,x1054482038361853952,156,21,"For three years, I’ve been honored to work with the remarkable members of the Governor’s Teacher Cabinet. We've tackled difficult issues, always believing Tennessee’s students are capable of great things. They will carry the momentum forward and I'm grateful for their service. https://t.co/1vUF48v8R3"
x26103389,BillHaslam,2018-10-31T21:32:57Z,x1057747274976165889,298,30,"I might be a little biased, but I think this year’s honoree for the Lipscomb Innovation in Education award is a great choice! Congratulations, Crissy. https://t.co/p3zFXnDxdC"
x26103389,BillHaslam,2018-11-07T01:58:36Z,x1059988455747395584,639,113,Congratulations to Governor-elect @BillLeeTN on a well-run race. Tennesseans have made a great choice for our next governor. Read my entire statement below. https://t.co/VTNOM2j0Bv
x26103389,BillHaslam,2018-11-07T22:46:34Z,x1060302518327095296,110,20,"Today, @CrissyHaslam and I had the privilege of recognizing Tennessee veterans and veteran state employees. More than 2,200 veterans work in state government. They are among our most transformational leaders. It's an honor to serve alongside them. https://t.co/wMrYlY95JA"
x26103389,BillHaslam,2018-11-08T22:54:09Z,x1060666815465033733,122,18,"When we talk about an opportunity to work for everyone, all means all. Today, I met some outstanding workers at @UTChattanooga, one of the many employers providing opportunities for those with disabilities featured in the 2018 Expect Employment Report. https://t.co/cFCnUVxmyk https://t.co/k5Ndfpjbkl"
x26103389,BillHaslam,2018-11-13T17:20:11Z,x1062394707903418368,143,34,"In honor and memory of my good friend, Representative Charles Sargent. https://t.co/Q2SciV2ytJ"
x26103389,BillHaslam,2018-11-13T21:57:30Z,x1062464497380671488,433,90,"This has been a game changing day for Tennessee. @EY_US is creating 600 and @amazon is creating 5,000 high-quality and high-paying jobs in TN because of our business-friendly policies, low taxes and skilled workforce. Thank you for your investments. Welcome to Team Tennessee. https://t.co/IKx0IuW97b"
x26103389,BillHaslam,2018-11-15T15:01:33Z,x1063084594000486401,66,40,"A record number of students have applied to @TNPromise, which means we need a record number of mentors! Please consider giving one hour per month as a mentor to a student.  A positive voice of encouragement makes a big difference.  Apply at https://t.co/LPEkQ71Dvx by 11/30. https://t.co/QGDh3pTe0P"
x26103389,BillHaslam,2018-11-15T18:27:31Z,x1063136427624554496,73,13,"Ben was a great public servant who truly only wanted what was best for his community and Tennessee. When I first thought about running for office, Sen. Atchley was one of the first people I went to for advice and the wisdom he shared was some of the best advice I ever received."
