user_id,screen_name,created_at,status_id,favorite_count,retweet_count,text
x16017475,NateSilver538,2018-11-14T03:07:03Z,x1062542397471625216,3024,225,"We're criticized 30 ways from Sunday whether our forecast is good, bad or indifferent, so we're sure as heck going to congratulate ourselves when we hit right on the nose (like this year), as well as when we give underdogs better odds than the consensus and they win (as in 2016). https://t.co/n3nvNPaB3W"
x16017475,NateSilver538,2018-11-14T14:27:13Z,x1062713566334279681,2133,649,"Hi all,

My friends are launching a journalism startup called The Correspondent. It's the opposite of pivot-to-video: in-depth, critical, ad-free. They're trying to get enough memberships in advance so they can hire a bunch of journalists. More here —&gt; https://t.co/KMv96DS2mX"
x16017475,NateSilver538,2018-11-14T15:06:59Z,x1062723577336815616,10488,2242,"Of course it was a wave, folks. https://t.co/D65NXHm3Se"
x16017475,NateSilver538,2018-11-14T16:18:48Z,x1062741649590284288,187,24,"Here's what I'd say the conventional wisdom was (see next tweet for more detail). The conventional wisdom that they were favored to win the House sunk in gradually throughout 2017 (it took a while) and mostly held throughout 2018, although with a couple periods of doubt. https://t.co/i6LCTCn58t"
x16017475,NateSilver538,2018-11-14T18:03:04Z,x1062767886350147585,639,44,Nope https://t.co/qwn0yyc1ha
x16017475,NateSilver538,2018-11-14T19:01:56Z,x1062782704159256576,2601,233,Remember when you had skin in the game and interesting things to say (instead of having re-written the book you wrote in 2001 like 4 times) and weren't consumed by your anger @nntaleb? ... Sorry bro but you've kind of become an intellectual-yet-idiot. https://t.co/Y48LTwdDHg
x16017475,NateSilver538,2018-11-14T19:19:09Z,x1062787037227614208,580,156,We've got a @kirkgoldsberry sighting at 538! And it's about how Texas is becoming bluer. https://t.co/r5RPBszCHe https://t.co/OazW3g2Bms
x16017475,NateSilver538,2018-11-14T19:22:19Z,x1062787830685097985,604,94,"If true, whoa https://t.co/rx7kDx5hC5"
x16017475,NateSilver538,2018-11-14T23:04:12Z,x1062843670049812482,6990,701,Avenatti was bad news from day 1.
